{
  "schema_version": "2.0",
  "run_id": "20260916T165000Z_AbyssalReefLE_deadbeef",
  "seq": 1,
  "game_loop": 160,
  "game_time_s": 7.14,
  "source": "bot",
  "event_type": "gameplay_event",
  "name": "match_start",
  "code": null,
  "data": {
    "map": "AbyssalReefLE",
    "human_race": "Terran",
    "bot_race": "Zerg",
    "chaos": false,
    "realtime": false
  }
}
